{
  "$schema": "https://json-schema.org/draft/2020-12/schema",

  "type": "object",
  "properties": {
    "name": { "type": "string" },
    "aliases": {
      "type": "array",
      "items": { "type": "string" }
    },
    "description": { "$ref": "types.json#/$defs/string-or-null"},
    "homepage": { "$ref": "types.json#/$defs/string-or-null"},
    "private": { "type": "boolean" },
    "has_discussions": { "type": "boolean" },
    "has_issues": { "type": "boolean" },
    "has_projects": { "type": "boolean" },
    "has_wiki": { "type": "boolean" },
    "is_template": { "type": "boolean" },
    "template_repository": { "$ref": "types.json#/$defs/string-or-null"},
    "post_process_template_content": {
      "type": "array",
      "items": { "type": "string" }
    },
    "forked_repository": { "$ref": "types.json#/$defs/string-or-null"},
    "fork_default_branch_only": { "type": "boolean" },
    "auto_init": { "type": "boolean" },
    "topics": {
      "type": "array",
      "items": { "type": "string" }
    },
    "default_branch": { "type": "string" },
    "allow_rebase_merge": { "type": "boolean" },
    "allow_merge_commit": { "type": "boolean" },
    "allow_squash_merge": { "type": "boolean" },
    "allow_auto_merge": { "type": "boolean" },
    "delete_branch_on_merge": { "type": "boolean" },
    "allow_update_branch": { "type": "boolean" },
    "squash_merge_commit_title": { "type": "string", "enum": ["PR_TITLE", "COMMIT_OR_PR_TITLE"] },
    "squash_merge_commit_message": { "type": "string", "enum": ["PR_BODY", "COMMIT_MESSAGES", "BLANK"] },
    "merge_commit_title": { "type": "string", "enum": ["PR_TITLE", "MERGE_MESSAGE"] },
    "merge_commit_message": { "type": "string", "enum": ["PR_TITLE", "PR_BODY", "BLANK"] },
    "archived": { "type": "boolean" },
    "allow_forking": { "type": "boolean" },
    "web_commit_signoff_required": { "type": "boolean" },
    "immutable_releases_enabled": { "type": "boolean" },
    "secret_scanning": { "type": "string" },
    "secret_scanning_push_protection": { "type": "string" },
    "dependabot_alerts_enabled": { "type": "boolean" },
    "dependabot_security_updates_enabled": { "type": "boolean" },
    "private_vulnerability_reporting_enabled": { "type": "boolean" },

    "code_scanning_default_setup_enabled": { "type": "boolean" },
    "code_scanning_default_query_suite": { "type": "string", "enum": ["default", "extended"] },
    "code_scanning_default_languages": {
      "type": "array",
      "items": {
        "type": "string",
        "enum": ["actions", "c-cpp", "csharp", "go", "java-kotlin", "javascript-typescript", "python", "ruby", "swift", "rust"]
      }
    },

    "custom_properties": { "$ref": "types.json#/$defs/object-or-null"},

    "gh_pages_build_type": { "type": "string", "enum": ["disabled", "legacy", "workflow"] },
    "gh_pages_source_branch": { "$ref": "types.json#/$defs/string-or-null"},
    "gh_pages_source_path": { "$ref": "types.json#/$defs/string-or-null"},
    "gh_pages_visibility": { "type": "string", "enum": ["public", "private"] },
    "gh_pages_cname": { "$ref": "types.json#/$defs/string-or-null"},
    "gh_pages_https_enforced": { "type": "boolean" },
    "workflows": { "$ref": "repo-workflow-settings.json" },
    "branch_protection_rules": {
      "type": "array",
      "items": { "$ref": "branch-protection-rule.json" }
    },
    "rulesets": {
      "type": "array",
      "items": { "$ref": "repo-ruleset.json"}
    },
    "webhooks": {
      "type": "array",
      "items": { "$ref": "webhook.json" }
    },
    "secrets": {
      "type": "array",
      "items": { "$ref": "repo-secret.json" }
    },
    "variables": {
      "type": "array",
      "items": { "$ref": "repo-variable.json" }
    },
    "environments": {
      "type": "array",
      "items": { "$ref": "environment.json" }
    },
    "team_permissions": {
      "type": "object",
      "patternProperties": {
        ".*": { "$ref": "team-permission.json" }
      },
      "additionalProperties": false
    }
  },

  "required": [ "name", "private" ],
  "additionalProperties": false
}
