{
  "aliases": ["oldname"],
  "allow_forking": true,
  "has_wiki": true,
  "web_commit_signoff_required": false,
  "allow_rebase_merge": true,
  "squash_merge_commit_message": "COMMIT_MESSAGES",
  "archived": false,
  "has_projects": true,
  "merge_commit_title": "MERGE_MESSAGE",
  "has_issues": true,
  "private": false,
  "squash_merge_commit_title": "COMMIT_OR_PR_TITLE",
  "homepage": null,
  "default_branch": "main",
  "description": null,
  "allow_update_branch": false,
  "allow_squash_merge": true,
  "delete_branch_on_merge": false,
  "name": "otterdog-defaults",
  "allow_merge_commit": true,
  "allow_auto_merge": false,
  "merge_commit_message": "PR_TITLE",
  "immutable_releases_enabled": true,
  "secret_scanning": "enabled",
  "dependabot_alerts_enabled": true,
  "gh_pages_build_type": "legacy",
  "gh_pages_source_path": "/",
  "gh_pages_source_branch": "gh-pages"
}
